Section,Matthew,,,,Mark,,,,Luke,,,,John,,,
,7,2,"For with the judgment you pronounce you will be judged, and with the measure you use it will be measured to you.",,,,,,,,,,,,,
,7,3,"Why do you see the speck that is in your brother's eye, but do not notice the log that is in your own eye?",,,,,,,,,,,,,
,7,4,"Or how can you say to your brother, 'Let me take the speck out of your eye,' when there is the log in your own eye?",,,,,,,,,,,,,
,7,5,"You hypocrite, first take the log out of your own eye, and then you will see clearly to take the speck out of your brother's eye.",,,,,,,,,,,,,
,7,6,"""Do not give dogs what is holy, and do not throw your pearls before pigs, lest they trample them underfoot and turn to attack you.",,,,,,,,,,,,,
,7,7,"""Ask, and it will be given to you; seek, and you will find; knock, and it will be opened to you.",,,,,,,,,,,,,
,7,8,"For everyone who asks receives, and the one who seeks finds, and to the one who knocks it will be opened.",,,,,,,,,,,,,
,7,9,"Or which one of you, if his son asks him for bread, will give him a stone?",,,,,,,,,,,,,
,7,10,"Or if he asks for a fish, will give him a serpent?",,,,,,,,,,,,,
,7,11,"If you then, who are evil, know how to give good gifts to your children, how much more will your Father who is in heaven give good things to those who ask him!",,,,,,,,,,,,,
,7,12,"""So whatever you wish that others would do to you, do also to them, for this is the Law and the Prophets.",,,,,,,,,,,,,
,7,13,"""Enter by the narrow gate. For the gate is wide and the way is easy that leads to destruction, and those who enter by it are many.",,,,,,,,,,,,,
,7,14,"For the gate is narrow and the way is hard that leads to life, and those who find it are few.",,,,,,,,,,,,,
,7,15,"""Beware of false prophets, who come to you in sheep's clothing but inwardly are ravenous wolves.",,,,,,,,,,,,,
,7,16,"You will recognize them by their fruits. Are grapes gathered from thornbushes, or figs from thistles?",,,,,,,,,,,,,
,7,17,"So, every healthy tree bears good fruit, but the diseased tree bears bad fruit.",,,,,,,,,,,,,
,7,18,"A healthy tree cannot bear bad fruit, nor can a diseased tree bear good fruit.",,,,,,,,,,,,,
,7,19,Every tree that does not bear good fruit is cut down and thrown into the fire.,,,,,,,,,,,,,
,7,20,Thus you will recognize them by their fruits.,,,,,,,,,,,,,
,7,21,"""Not everyone who says to me, 'Lord, Lord,' will enter the kingdom of heaven, but the one who does the will of my Father who is in heaven.",,,,,,,,,,,,,
,7,22,"On that day many will say to me, 'Lord, Lord, did we not prophesy in your name, and cast out demons in your name, and do many mighty works in your name?'",,,,,,,,,,,,,
,7,23,"And then will I declare to them, 'I never knew you; depart from me, you workers of lawlessness.'",,,,,,,,,,,,,
,7,24,"""Everyone then who hears these words of mine and does them will be like a wise man who built his house on the rock.",,,,,,,,,,,,,
,7,25,"And the rain fell, and the floods came, and the winds blew and beat on that house, but it did not fall, because it had been founded on the rock.",,,,,,,,,,,,,
,7,26,And everyone who hears these words of mine and does not do them will be like a foolish man who built his house on the sand.,,,,,,,,,,,,,
,7,27,"And the rain fell, and the floods came, and the winds blew and beat against that house, and it fell, and great was the fall of it.""",,,,,,,,,,,,,
,7,28,"And when Jesus finished these sayings, the crowds were astonished at his teaching,",,,,,,,,,,,,,
,7,29,"for he was teaching them as one who had authority, and not as their scribes.",,,,,,,,,,,,,
,8,1,"When he came down from the mountain, great crowds followed him.",,,,,,,,,,,,,
,,,,,,,,,,,,,,,,
,8,5,"When he entered Capernaum, a centurion came forward to him, appealing to him,",,,,,,7,1,"After he had finished all his sayings in the hearing of the people, he entered Capernaum.",,,,,
,8,6,"""Lord, my servant is lying paralyzed at home, suffering terribly.""",,,,,,7,2,"Now a centurion had a servant who was sick and at the point of death, who was highly valued by him.",,,,,
,8,7,"And he said to him, ""I will come and heal him.""",,,,,,7,3,"When the centurion heard about Jesus, he sent to him elders of the Jews, asking him to come and heal his servant.",,,,,
,8,8,"But the centurion replied, ""Lord, I am not worthy to have you come under my roof, but only say the word, and my servant will be healed.",,,,,,7,4,"And when they came to Jesus, they pleaded with him earnestly, saying, ""He is worthy to have you do this for him,",,,,,
,8,9,"For I too am a man under authority, with soldiers under me. And I say to one, 'Go,' and he goes, and to another, 'Come,' and he comes, and to my servant, 'Do this,' and he does it.""",,,,,,7,5,"for he loves our nation, and he is the one who built us our synagogue.""",,,,,
,8,10,"When Jesus heard this, he marveled and said to those who followed him, ""Truly, I tell you, with no one in Israel have I found such faith.",,,,,,7,6,"And Jesus went with them. When he was not far from the house, the centurion sent friends, saying to him, ""Lord, do not trouble yourself, for I am not worthy to have you come under my roof.",,,,,
,8,11,"I tell you, many will come from east and west and recline at table with Abraham, Isaac, and Jacob in the kingdom of heaven,",,,,,,7,7,"Therefore I did not presume to come to you. But say the word, and let my servant be healed.",,,,,
,8,12,"while the sons of the kingdom will be thrown into the outer darkness. In that place there will be weeping and gnashing of teeth.""",,,,,,7,8,"For I too am a man set under authority, with soldiers under me: and I say to one, 'Go,' and he goes; and to another, 'Come,' and he comes; and to my servant, 'Do this,' and he does it.""",,,,,
,8,13,"And to the centurion Jesus said, ""Go; let it be done for you as you have believed."" And the servant was healed at that very moment.",,,,,,7,9,"When Jesus heard these things, he marveled at him, and turning to the crowd that followed him, said, ""I tell you, not even in Israel have I found such faith.""",,,,,
,,,,,,,,,7,10,"And when those who had been sent returned to the house, they found the servant well.",,,,,
,,,,,,,,,7,11,"Soon afterward he went to a town called Nain, and his disciples and a great crowd went with him.",,,,,
,,,,,,,,,7,12,"As he drew near to the gate of the town, behold, a man who had died was being carried out, the only son of his mother, and she was a widow, and a considerable crowd from the town was with her.",,,,,
,,,,,,,,,7,13,"And when the Lord saw her, he had compassion on her and said to her, ""Do not weep.""",,,,,
,,,,,,,,,7,14,"Then he came up and touched the bier, and the bearers stood still. And he said, ""Young man, I say to you, arise.""",,,,,
,,,,,,,,,7,15,"And the dead man sat up and began to speak, and Jesus gave him to his mother.",,,,,
,,,,,,,,,7,16,"Fear seized them all, and they glorified God, saying, ""A great prophet has arisen among us!"" and ""God has visited his people!""",,,,,
,,,,,,,,,7,17,And this report about him spread through the whole of Judea and all the surrounding country.,,,,,
,11,2,"Now when John heard in prison about the deeds of the Christ, he sent word by his disciples",,,,,,7,18,"The disciples of John reported all these things to him. And John,",,,,,
,11,3,"and said to him, ""Are you the one who is to come, or shall we look for another?""",,,,,,7,19,"calling two of his disciples to him, sent them to the Lord, saying, ""Are you the one who is to come, or shall we look for another?""",,,,,
,11,4,"And Jesus answered them, ""Go and tell John what you hear and see:",,,,,,7,20,"And when the men had come to him, they said, ""John the Baptist has sent us to you, saying, 'Are you the one who is to come, or shall we look for another?'""",,,,,
,11,5,"the blind receive their sight and the lame walk, lepers are cleansed and the deaf hear, and the dead are raised up, and the poor have good news preached to them.",,,,,,7,21,"In that hour he healed many people of diseases and plagues and evil spirits, and on many who were blind he bestowed sight.",,,,,
,11,6,"And blessed is the one who is not offended by me.""",,,,,,7,22,"And he answered them, ""Go and tell John what you have seen and heard: the blind receive their sight, the lame walk, lepers are cleansed, and the deaf hear, the dead are raised up, the poor have good news preached to them.",,,,,
,,,,,,,,,7,23,"And blessed is the one who is not offended by me.""",,,,,
,11,7,"As they went away, Jesus began to speak to the crowds concerning John: ""What did you go out into the wilderness to see? A reed shaken by the wind?",,,,,,7,24,"When John's messengers had gone, Jesus began to speak to the crowds concerning John: ""What did you go out into the wilderness to see? A reed shaken by the wind?",,,,,
,11,8,"What then did you go out to see? A man dressed in soft clothing? Behold, those who wear soft clothing are in kings' houses.",,,,,,7,25,"What then did you go out to see? A man dressed in soft clothing? Behold, those who are dressed in splendid clothing and live in luxury are in kings' courts.",,,,,
,11,9,"What then did you go out to see? A prophet? Yes, I tell you, and more than a prophet.",,,,,,7,26,"What then did you go out to see? A prophet? Yes, I tell you, and more than a prophet.",,,,,
,11,10,"This is he of whom it is written, ""'Behold, I send my messenger before your face, who will prepare your way before you.'",,,,,,7,27,"This is he of whom it is written, ""'Behold, I send my messenger before your face, who will prepare your way before you.'",,,,,
,11,11,"Truly, I say to you, among those born of women there has arisen no one greater than John the Baptist. Yet the one who is least in the kingdom of heaven is greater than he.",,,,,,7,28,"I tell you, among those born of women none is greater than John. Yet the one who is least in the kingdom of God is greater than he.""",,,,,
,11,12,"From the days of John the Baptist until now the kingdom of heaven has suffered violence, and the violent take it by force.",,,,,,7,29,"(When all the people heard this, and the tax collectors too, they declared God just, having been baptized with the baptism of John,",,,,,
,11,13,"For all the Prophets and the Law prophesied until John,",,,,,,7,30,"but the Pharisees and the lawyers rejected the purpose of God for themselves, not having been baptized by him.)",,,,,
,11,14,"and if you are willing to accept it, he is Elijah who is to come.",,,,,,7,31,"""To what then shall I compare the people of this generation, and what are they like?",,,,,
,11,15,"He who has ears to hear, let him hear.",,,,,,7,32,"They are like children sitting in the marketplace and calling to one another, ""'We played the flute for you, and you did not dance; we sang a dirge, and you did not weep.'",,,,,
,11,16,"""But to what shall I compare this generation? It is like children sitting in the marketplaces and calling to their playmates,",,,,,,7,33,"For John the Baptist has come eating no bread and drinking no wine, and you say, 'He has a demon.'",,,,,
,11,17,"""'We played the flute for you, and you did not dance; we sang a dirge, and you did not mourn.'",,,,,,7,34,"The Son of Man has come eating and drinking, and you say, 'Look at him! A glutton and a drunkard, a friend of tax collectors and sinners!'",,,,,
,11,18,"For John came neither eating nor drinking, and they say, 'He has a demon.'",,,,,,7,35,"Yet wisdom is justified by all her children.""",,,,,
,11,19,"The Son of Man came eating and drinking, and they say, 'Look at him! A glutton and a drunkard, a friend of tax collectors and sinners!' Yet wisdom is justified by her deeds.""",,,,,,,,,,,,,
,11,20,"Then he began to denounce the cities where most of his mighty works had been done, because they did not repent.",,,,,,,,,,,,,
,11,21,"""Woe to you, Chorazin! Woe to you, Bethsaida! For if the mighty works done in you had been done in Tyre and Sidon, they would have repented long ago in sackcloth and ashes.",,,,,,,,,,,,,
,11,22,"But I tell you, it will be more bearable on the day of judgment for Tyre and Sidon than for you.",,,,,,,,,,,,,
,11,23,"And you, Capernaum, will you be exalted to heaven? You will be brought down to Hades. For if the mighty works done in you had been done in Sodom, it would have remained until this day.",,,,,,,,,,,,,
,11,24,"But I tell you that it will be more tolerable on the day of judgment for the land of Sodom than for you.""",,,,,,,,,,,,,
,11,25,"At that time Jesus declared, ""I thank you, Father, Lord of heaven and earth, that you have hidden these things from the wise and understanding and revealed them to little children;",,,,,,,,,,,,,
,11,26,"yes, Father, for such was your gracious will.",,,,,,,,,,,,,
,11,27,"All things have been handed over to me by my Father, and no one knows the Son except the Father, and no one knows the Father except the Son and anyone to whom the Son chooses to reveal him.",,,,,,,,,,,,,
,11,28,"Come to me, all who labor and are heavy laden, and I will give you rest.",,,,,,,,,,,,,
,11,29,"Take my yoke upon you, and learn from me, for I am gentle and lowly in heart, and you will find rest for your souls.",,,,,,,,,,,,,
,11,30,"For my yoke is easy, and my burden is light.""",,,,,,,,,,,,,
,,,,,,,,,7,36,"One of the Pharisees asked him to eat with him, and he went into the Pharisee's house and took his place at the table.",,,,,
,,,,,,,,,7,37,"And behold, a woman of the city, who was a sinner, when she learned that he was reclining at table in the Pharisee's house, brought an alabaster flask of ointment,",,,,,
,,,,,,,,,7,38,"and standing behind him at his feet, weeping, she began to wet his feet with her tears and wiped them with the hair of her head and kissed his feet and anointed them with the ointment.",,,,,
,,,,,,,,,7,39,"Now when the Pharisee who had invited him saw this, he said to himself, ""If this man were a prophet, he would have known who and what sort of woman this is who is touching him, for she is a sinner.""",,,,,
,,,,,,,,,7,40,"And Jesus answering said to him, ""Simon, I have something to say to you."" And he answered, ""Say it, Teacher.""",,,,,
,,,,,,,,,7,41,"""A certain moneylender had two debtors. One owed five hundred denarii, and the other fifty.",,,,,
,,,,,,,,,7,42,"When they could not pay, he cancelled the debt of both. Now which of them will love him more?""",,,,,
,,,,,,,,,7,43,"Simon answered, ""The one, I suppose, for whom he cancelled the larger debt."" And he said to him, ""You have judged rightly.""",,,,,
,,,,,,,,,7,44,"Then turning toward the woman he said to Simon, ""Do you see this woman? I entered your house; you gave me no water for my feet, but she has wet my feet with her tears and wiped them with her hair.",,,,,
,,,,,,,,,7,45,"You gave me no kiss, but from the time I came in she has not ceased to kiss my feet.",,,,,
,,,,,,,,,7,46,"You did not anoint my head with oil, but she has anointed my feet with ointment.",,,,,
,,,,,,,,,7,47,"Therefore I tell you, her sins, which are many, are forgiven--for she loved much. But he who is forgiven little, loves little.""",,,,,
,,,,,,,,,7,48,"And he said to her, ""Your sins are forgiven.""",,,,,
,,,,,,,,,7,49,"Then those who were at table with him began to say among themselves, ""Who is this, who even forgives sins?""",,,,,
,,,,,,,,,7,50,"And he said to the woman, ""Your faith has saved you; go in peace.""",,,,,
,,,,,,,,,8,1,"Soon afterward he went on through cities and villages, proclaiming and bringing the good news of the kingdom of God. And the twelve were with him,",,,,,
,,,,,,,,,8,2,"and also some women who had been healed of evil spirits and infirmities: Mary, called Magdalene, from whom seven demons had gone out,",,,,,
,,,,,,,,,8,3,"and Joanna, the wife of Chuza, Herod's household manager, and Susanna, and many others, who provided for them out of their means.",,,,,
,12,22,"Then a demon-oppressed man who was blind and mute was brought to him, and he healed him, so that the man spoke and saw.",,3,20,"Then he went home, and the crowd gathered again, so that they could not even eat.",,,,,,,,,
,12,23,"And all the people were amazed, and said, ""Can this be the Son of David?""",,3,21,"And when his family heard it, they went out to seize him, for they were saying, ""He is out of his mind.""",,,,,,,,,
,,,,,3,22,"And the scribes who came down from Jerusalem were saying, ""He is possessed by Beelzebul,"" and ""by the prince of demons he casts out the demons.""",,,,,,,,,
,12,24,"But when the Pharisees heard it, they said, ""It is only by Beelzebul, the prince of demons, that this man casts out demons.""",,3,23,"And he called them to him and said to them in parables, ""How can Satan cast out Satan?",,,,,,,,,
,12,25,"Knowing their thoughts, he said to them, ""Every kingdom divided against itself is laid waste, and no city or house divided against itself will stand.",,3,24,"If a kingdom is divided against itself, that kingdom cannot stand.",,,,,,,,,
,12,26,"And if Satan casts out Satan, he is divided against himself. How then will his kingdom stand?",,3,25,"And if a house is divided against itself, that house will not be able to stand.",,,,,,,,,
,12,27,"And if I cast out demons by Beelzebul, by whom do your sons cast them out? Therefore they will be your judges.",,3,26,"And if Satan has risen up against himself and is divided, he cannot stand, but is coming to an end.",,,,,,,,,
,12,28,"But if it is by the Spirit of God that I cast out demons, then the kingdom of God has come upon you.",,3,27,"But no one can enter a strong man's house and plunder his goods, unless he first binds the strong man. Then indeed he may plunder his house.",,,,,,,,,
,12,29,"Or how can someone enter a strong man's house and plunder his goods, unless he first binds the strong man? Then indeed he may plunder his house.",,3,28,"""Truly, I say to you, all sins will be forgiven the children of man, and whatever blasphemies they utter,",,,,,,,,,
,12,30,"Whoever is not with me is against me, and whoever does not gather with me scatters.",,3,29,"but whoever blasphemes against the Holy Spirit never has forgiveness, but is guilty of an eternal sin""--",,,,,,,,,
,12,31,"Therefore I tell you, every sin and blasphemy will be forgiven people, but the blasphemy against the Spirit will not be forgiven.",,3,30,"for they had said, ""He has an unclean spirit.""",,,,,,,,,
,12,32,"And whoever speaks a word against the Son of Man will be forgiven, but whoever speaks against the Holy Spirit will not be forgiven, either in this age or in the age to come.",,,,,,,,,,,,,
,12,33,"""Either make the tree good and its fruit good, or make the tree bad and its fruit bad, for the tree is known by its fruit.",,,,,,,,,,,,,
,12,34,"You brood of vipers! How can you speak good, when you are evil? For out of the abundance of the heart the mouth speaks.",,,,,,,,,,,,,
,12,35,"The good person out of his good treasure brings forth good, and the evil person out of his evil treasure brings forth evil.",,,,,,,,,,,,,
,12,36,"I tell you, on the day of judgment people will give account for every careless word they speak,",,,,,,,,,,,,,
,12,37,"for by your words you will be justified, and by your words you will be condemned.""",,,,,,,,,,,,,
,12,38,"Then some of the scribes and Pharisees answered him, saying, ""Teacher, we wish to see a sign from you.""",,,,,,,,,,,,,
,12,39,"But he answered them, ""An evil and adulterous generation seeks for a sign, but no sign will be given to it except the sign of the prophet Jonah.",,,,,,,,,,,,,
,12,40,"For just as Jonah was three days and three nights in the belly of the great fish, so will the Son of Man be three days and three nights in the heart of the earth.",,,,,,,,,,,,,
,12,41,"The men of Nineveh will rise up at the judgment with this generation and condemn it, for they repented at the preaching of Jonah, and behold, something greater than Jonah is here.",,,,,,,,,,,,,
,12,42,"The queen of the South will rise up at the judgment with this generation and condemn it, for she came from the ends of the earth to hear the wisdom of Solomon, and behold, something greater than Solomon is here.",,,,,,,,,,,,,
,12,43,"""When the unclean spirit has gone out of a person, it passes through waterless places seeking rest, but finds none.",,,,,,,,,,,,,
,12,44,"Then it says, 'I will return to my house from which I came.' And when it comes, it finds the house empty, swept, and put in order.",,,,,,,,,,,,,
,12,45,"Then it goes and brings with it seven other spirits more evil than itself, and they enter and dwell there, and the last state of that person is worse than the first. So also will it be with this evil generation.""",,,,,,,,,,,,,
,12,46,"While he was still speaking to the people, behold, his mother and his brothers stood outside, asking to speak to him.",,3,31,"And his mother and his brothers came, and standing outside they sent to him and called him.",,8,19,"Then his mother and his brothers came to him, but they could not reach him because of the crowd.",,,,,
,12,48,"But he replied to the man who told him, ""Who is my mother, and who are my brothers?""",,3,32,"And a crowd was sitting around him, and they said to him, ""Your mother and your brothers are outside, seeking you.""",,8,20,"And he was told, ""Your mother and your brothers are standing outside, desiring to see you.""",,,,,
,12,49,"And stretching out his hand toward his disciples, he said, ""Here are my mother and my brothers!",,3,33,"And he answered them, ""Who are my mother and my brothers?""",,8,21,"But he answered them, ""My mother and my brothers are those who hear the word of God and do it.""",,,,,
,12,50,"For whoever does the will of my Father in heaven is my brother and sister and mother.""",,3,34,"And looking about at those who sat around him, he said, ""Here are my mother and my brothers!",,,,,,,,,
,,,,,3,35,"Whoever does the will of God, he is my brother and sister and mother.""",,,,,,,,,
,13,1,That same day Jesus went out of the house and sat beside the sea.,,4,1,"Again he began to teach beside the sea. And a very large crowd gathered about him, so that he got into a boat and sat in it on the sea, and the whole crowd was beside the sea on the land.",,8,4,"And when a great crowd was gathering and people from town after town came to him, he said in a parable:",,,,,
,13,2,"And great crowds gathered about him, so that he got into a boat and sat down. And the whole crowd stood on the beach.",,4,2,"And he was teaching them many things in parables, and in his teaching he said to them:",,8,5,"""A sower went out to sow his seed. And as he sowed, some fell along the path and was trampled underfoot, and the birds of the air devoured it.",,,,,
,13,3,"And he told them many things in parables, saying: ""A sower went out to sow.",,4,3,"""Listen! A sower went out to sow.",,8,6,"And some fell on the rock, and as it grew up, it withered away, because it had no moisture.",,,,,
,13,4,"And as he sowed, some seeds fell along the path, and the birds came and devoured them.",,4,4,"And as he sowed, some seed fell along the path, and the birds came and devoured it.",,8,7,"And some fell among thorns, and the thorns grew up with it and choked it.",,,,,
,13,5,"Other seeds fell on rocky ground, where they did not have much soil, and immediately they sprang up, since they had no depth of soil,",,4,5,"Other seed fell on rocky ground, where it did not have much soil, and immediately it sprang up, since it had no depth of soil.",,8,8,"And some fell into good soil and grew and yielded a hundredfold."" As he said these things, he called out, ""He who has ears to hear, let him hear.""",,,,,
,13,6,"but when the sun rose they were scorched. And since they had no root, they withered away.",,4,6,"And when the sun rose it was scorched, and since it had no root, it withered away.",,8,9,"And when his disciples asked him what this parable meant,",,,,,
,13,7,"Other seeds fell among thorns, and the thorns grew up and choked them.",,4,7,"Other seed fell among thorns, and the thorns grew up and choked it, and it yielded no grain.",,8,10,"he said, ""To you it has been given to know the secrets of the kingdom of God, but for others they are in parables, so that 'seeing they may not see, and hearing they may not understand.'",,,,,
,13,8,"Other seeds fell on good soil and produced grain, some a hundredfold, some sixty, some thirty.",,4,8,"And other seeds fell into good soil and produced grain, growing up and increasing and yielding thirtyfold and sixtyfold and a hundredfold.""",,8,11,Now the parable is this: The seed is the word of God.,,,,,
,13,9,"He who has ears, let him hear.""",,4,9,"And he said, ""He who has ears to hear, let him hear.""",,8,12,"The ones along the path are those who have heard. Then the devil comes and takes away the word from their hearts, so that they may not believe and be saved.",,,,,
,13,10,"Then the disciples came and said to him, ""Why do you speak to them in parables?""",,4,10,"And when he was alone, those around him with the twelve asked him about the parables.",,8,13,"And the ones on the rock are those who, when they hear the word, receive it with joy. But these have no root; they believe for a while, and in time of testing fall away.",,,,,
,13,11,"And he answered them, ""To you it has been given to know the secrets of the kingdom of heaven, but to them it has not been given.",,4,11,"And he said to them, ""To you has been given the secret of the kingdom of God, but for those outside everything is in parables,",,8,14,"And as for what fell among the thorns, they are those who hear, but as they go on their way they are choked by the cares and riches and pleasures of life, and their fruit does not mature.",,,,,
