Section,Matthew,,,,Mark,,,,Luke,,,,John,,,
,24,10,And then many will fall away and betray one another and hate one another.,,13,11,"And when they bring you to trial and deliver you over, do not be anxious beforehand what you are to say, but say whatever is given you in that hour, for it is not you who speak, but the Holy Spirit.",,21,14,"Settle it therefore in your minds not to meditate beforehand how to answer,",,,,,
,24,11,And many false prophets will arise and lead many astray.,,13,12,"And brother will deliver brother over to death, and the father his child, and children will rise against parents and have them put to death.",,21,15,"for I will give you a mouth and wisdom, which none of your adversaries will be able to withstand or contradict.",,,,,
,24,12,"And because lawlessness will be increased, the love of many will grow cold.",,13,13,And you will be hated by all for my name's sake. But the one who endures to the end will be saved.,,21,16,"You will be delivered up even by parents and brothers and relatives and friends, and some of you they will put to death.",,,,,
,24,13,But the one who endures to the end will be saved.,,,,,,21,17,You will be hated by all for my name's sake.,,,,,
,24,14,"And this gospel of the kingdom will be proclaimed throughout the whole world as a testimony to all nations, and then the end will come.",,,,,,21,18,But not a hair of your head will perish.,,,,,
,,,,,,,,,21,19,By your endurance you will gain your lives.,,,,,
,24,15,"""So when you see the abomination of desolation spoken of by the prophet Daniel, standing in the holy place (let the reader understand),",,13,14,"""But when you see the abomination of desolation standing where it ought not to be (let the reader understand), then let those who are in Judea flee to the mountains.",,21,20,"""But when you see Jerusalem surrounded by armies, then know that its desolation has come near.",,,,,
,24,16,then let those who are in Judea flee to the mountains.,,13,15,"Let the one who is on the housetop not go down, nor enter his house, to take anything out,",,21,21,"Then let those who are in Judea flee to the mountains, and let those who are inside the city depart, and let not those who are out in the country enter it,",,,,,
,24,17,"Let the one who is on the housetop not go down to take what is in his house,",,13,16,and let the one who is in the field not turn back to take his cloak.,,21,22,"for these are days of vengeance, to fulfill all that is written.",,,,,
,24,18,and let the one who is in the field not turn back to take his cloak.,,13,17,And alas for women who are pregnant and for those who are nursing infants in those days!,,21,23,Alas for women who are pregnant and for those who are nursing infants in those days! For there will be great distress upon the earth and wrath against this people.,,,,,
,24,19,And alas for women who are pregnant and for those who are nursing infants in those days!,,13,18,Pray that it may not happen in winter.,,21,24,"They will fall by the edge of the sword and be led captive among all nations, and Jerusalem will be trampled underfoot by the Gentiles, until the times of the Gentiles are fulfilled.",,,,,
,24,20,Pray that your flight may not be in winter or on a Sabbath.,,13,19,"For in those days there will be such tribulation as has not been from the beginning of the creation that God created until now, and never will be.",,,,,,,,,
,24,21,"For then there will be great tribulation, such as has not been from the beginning of the world until now, no, and never will be.",,13,20,"And if the Lord had not cut short the days, no human being would be saved. But for the sake of the elect, whom he chose, he shortened the days.",,,,,,,,,
,24,22,"And if those days had not been cut short, no human being would be saved. But for the sake of the elect those days will be cut short.",,13,21,"And then if anyone says to you, 'Look, here is the Christ!' or 'Look, there he is!' do not believe it.",,,,,,,,,
,24,23,"Then if anyone says to you, 'Look, here is the Christ!' or 'There he is!' do not believe it.",,13,22,"False christs and false prophets will arise and perform signs and wonders, to lead astray, if possible, the elect.",,,,,,,,,
,24,24,"For false christs and false prophets will arise and perform great signs and wonders, so as to lead astray, if possible, even the elect.",,13,23,But be on guard; I have told you all things beforehand.,,,,,,,,,
,24,25,"See, I have told you beforehand.",,,,,,,,,,,,,
,24,26,"So, if they say to you, 'Look, he is in the wilderness,' do not go out. If they say, 'Look, he is in the inner rooms,' do not believe it.",,,,,,,,,,,,,
,24,27,"For as the lightning comes from the east and shines as far as the west, so will be the coming of the Son of Man.",,,,,,,,,,,,,
,24,28,"Wherever the corpse is, there the vultures will gather.",,,,,,,,,,,,,
*,24,29,"""Immediately after the tribulation of those days the sun will be darkened, and the moon will not give its light, and the stars will fall from heaven, and the powers of the heavens will be shaken.",,13,24,"""But in those days, after that tribulation, the sun will be darkened, and the moon will not give its light,",,21,25,"""And there will be signs in sun and moon and stars, and on the earth distress of nations in perplexity because of the roaring of the sea and the waves,",,,,,
,24,30,"Then will appear in heaven the sign of the Son of Man, and then all the tribes of the earth will mourn, and they will see the Son of Man coming on the clouds of heaven with power and great glory.",,13,25,"and the stars will be falling from heaven, and the powers in the heavens will be shaken.",,21,26,people fainting with fear and with foreboding of what is coming on the world. For the powers of the heavens will be shaken.,,,,,
,24,31,"And he will send out his angels with a loud trumpet call, and they will gather his elect from the four winds, from one end of heaven to the other.",,13,26,And then they will see the Son of Man coming in clouds with great power and glory.,,21,27,And then they will see the Son of Man coming in a cloud with power and great glory.,,,,,
,,,,,13,27,"And then he will send out the angels and gather his elect from the four winds, from the ends of the earth to the ends of heaven.",,21,28,"Now when these things begin to take place, straighten up and raise your heads, because your redemption is drawing near.""",,,,,
*,24,32,"""From the fig tree learn its lesson: as soon as its branch becomes tender and puts out its leaves, you know that summer is near.",,13,28,"""From the fig tree learn its lesson: as soon as its branch becomes tender and puts out its leaves, you know that summer is near.",,21,29,"And he told them a parable: ""Look at the fig tree, and all the trees.",,,,,
,24,33,"So also, when you see all these things, you know that he is near, at the very gates.",,13,29,"So also, when you see these things taking place, you know that he is near, at the very gates.",,21,30,"As soon as they come out in leaf, you see for yourselves and know that the summer is already near.",,,,,
,,,,,,,,,21,31,"So also, when you see these things taking place, you know that the kingdom of God is near.",,,,,
*,24,34,"Truly, I say to you, this generation will not pass away until all these things take place.",,13,30,"Truly, I say to you, this generation will not pass away until all these things take place.",,21,32,"Truly, I say to you, this generation will not pass away until all has taken place.",,,,,
,24,35,"Heaven and earth will pass away, but my words will not pass away.",,13,31,"Heaven and earth will pass away, but my words will not pass away.",,21,33,"Heaven and earth will pass away, but my words will not pass away.",,,,,
,24,36,"""But concerning that day and hour no one knows, not even the angels of heaven, nor the Son, but the Father only.",,13,32,"""But concerning that day or that hour, no one knows, not even the angels in heaven, nor the Son, but only the Father.",,21,34,"""But watch yourselves lest your hearts be weighed down with dissipation and drunkenness and cares of this life, and that day come upon you suddenly like a trap.",,,,,
,24,37,"As were the days of Noah, so will be the coming of the Son of Man.",,13,33,"Be on guard, keep awake. For you do not know when the time will come.",,21,35,For it will come upon all who dwell on the face of the whole earth.,,,,,
,24,38,"For as in those days before the flood they were eating and drinking, marrying and giving in marriage, until the day when Noah entered the ark,",,13,34,"It is like a man going on a journey, when he leaves home and puts his servants in charge, each with his work, and commands the doorkeeper to stay awake.",,21,36,"But stay awake at all times, praying that you may have strength to escape all these things that are going to take place, and to stand before the Son of Man.""",,,,,
,24,39,"and they were unaware until the flood came and swept them all away, so will be the coming of the Son of Man.",,13,35,"Therefore stay awake--for you do not know when the master of the house will come, in the evening, or at midnight, or when the cock crows, or in the morning--",,,,,,,,,
,24,40,Then two men will be in the field; one will be taken and one left.,,13,36,lest he come suddenly and find you asleep.,,,,,,,,,
,24,41,Two women will be grinding at the mill; one will be taken and one left.,,13,37,"And what I say to you I say to all: Stay awake.""",,,,,,,,,
,24,42,"Therefore, stay awake, for you do not know on what day your Lord is coming.",,,,,,,,,,,,,
,24,43,"But know this, that if the master of the house had known in what part of the night the thief was coming, he would have stayed awake and would not have let his house be broken into.",,,,,,,,,,,,,
,24,44,"Therefore you also must be ready, for the Son of Man is coming at an hour you do not expect.",,,,,,,,,,,,,
,24,45,"""Who then is the faithful and wise servant, whom his master has set over his household, to give them their food at the proper time?",,,,,,,,,,,,,
,24,46,Blessed is that servant whom his master will find so doing when he comes.,,,,,,,,,,,,,
,24,47,"Truly, I say to you, he will set him over all his possessions.",,,,,,,,,,,,,
,24,48,"But if that wicked servant says to himself, 'My master is delayed,'",,,,,,,,,,,,,
,24,49,"and begins to beat his fellow servants and eats and drinks with drunkards,",,,,,,,,,,,,,
,24,50,the master of that servant will come on a day when he does not expect him and at an hour he does not know,,,,,,,,,,,,,
,24,51,and will cut him in pieces and put him with the hypocrites. In that place there will be weeping and gnashing of teeth.,,,,,,,,,,,,,
*,25,1,"""Then the kingdom of heaven will be like ten virgins who took their lamps and went to meet the bridegroom.",,,,,,,,,,,,,
,25,2,"Five of them were foolish, and five were wise.",,,,,,,,,,,,,
,25,3,"For when the foolish took their lamps, they took no oil with them,",,,,,,,,,,,,,
,25,4,but the wise took flasks of oil with their lamps.,,,,,,,,,,,,,
,25,5,"As the bridegroom was delayed, they all became drowsy and slept.",,,,,,,,,,,,,
,25,6,"But at midnight there was a cry, 'Here is the bridegroom! Come out to meet him.'",,,,,,,,,,,,,
,25,7,Then all those virgins rose and trimmed their lamps.,,,,,,,,,,,,,
,25,8,"And the foolish said to the wise, 'Give us some of your oil, for our lamps are going out.'",,,,,,,,,,,,,
,25,9,"But the wise answered, saying, 'Since there will not be enough for us and for you, go rather to the dealers and buy for yourselves.'",,,,,,,,,,,,,
,25,10,"And while they were going to buy, the bridegroom came, and those who were ready went in with him to the marriage feast, and the door was shut.",,,,,,,,,,,,,
,25,11,"Afterward the other virgins came also, saying, 'Lord, lord, open to us.'",,,,,,,,,,,,,
,25,12,"But he answered, 'Truly, I say to you, I do not know you.'",,,,,,,,,,,,,
,25,13,"Watch therefore, for you know neither the day nor the hour.",,,,,,,,,,,,,
,25,14,"""For it will be like a man going on a journey, who called his servants and entrusted to them his property.",,,,,,,,,,,,,
,25,15,"To one he gave five talents, to another two, to another one, to each according to his ability. Then he went away.",,,,,,,,,,,,,
,25,16,"He who had received the five talents went at once and traded with them, and he made five talents more.",,,,,,,,,,,,,
,25,17,So also he who had the two talents made two talents more.,,,,,,,,,,,,,
,25,18,But he who had received the one talent went and dug in the ground and hid his master's money.,,,,,,,,,,,,,
,25,19,Now after a long time the master of those servants came and settled accounts with them.,,,,,,,,,,,,,
,25,20,"And he who had received the five talents came forward, bringing five talents more, saying, 'Master, you delivered to me five talents; here I have made five talents more.'",,,,,,,,,,,,,
,25,21,"His master said to him, 'Well done, good and faithful servant. You have been faithful over a little; I will set you over much. Enter into the joy of your master.'",,,,,,,,,,,,,
,25,22,"And he also who had the two talents came forward, saying, 'Master, you delivered to me two talents; here I have made two talents more.'",,,,,,,,,,,,,
,25,23,"His master said to him, 'Well done, good and faithful servant. You have been faithful over a little; I will set you over much. Enter into the joy of your master.'",,,,,,,,,,,,,
,25,24,"He also who had received the one talent came forward, saying, 'Master, I knew you to be a hard man, reaping where you did not sow, and gathering where you scattered no seed,",,,,,,,,,,,,,
,25,25,"so I was afraid, and I went and hid your talent in the ground. Here you have what is yours.'",,,,,,,,,,,,,
,25,26,"But his master answered him, 'You wicked and slothful servant! You knew that I reap where I have not sowed and gather where I scattered no seed?",,,,,,,,,,,,,
,25,27,"Then you ought to have invested my money with the bankers, and at my coming I should have received what was my own with interest.",,,,,,,,,,,,,
,25,28,So take the talent from him and give it to him who has the ten talents.,,,,,,,,,,,,,
,25,29,"For to everyone who has will more be given, and he will have an abundance. But from the one who has not, even what he has will be taken away.",,,,,,,,,,,,,
,25,30,And cast the worthless servant into the outer darkness. In that place there will be weeping and gnashing of teeth.',,,,,,,,,,,,,
,25,31,"""When the Son of Man comes in his glory, and all the angels with him, then he will sit on his glorious throne.",,,,,,,,,,,,,
,25,32,"Before him will be gathered all the nations, and he will separate people one from another as a shepherd separates the sheep from the goats.",,,,,,,,,,,,,
,25,33,"And he will place the sheep on his right, but the goats on the left.",,,,,,,,,,,,,
,25,34,"Then the King will say to those on his right, 'Come, you who are blessed by my Father, inherit the kingdom prepared for you from the foundation of the world.",,,,,,,,,,,,,
,25,35,"For I was hungry and you gave me food, I was thirsty and you gave me drink, I was a stranger and you welcomed me,",,,,,,,,,,,,,
,25,36,"I was naked and you clothed me, I was sick and you visited me, I was in prison and you came to me.'",,,,,,,,,,,,,
,25,37,"Then the righteous will answer him, saying, 'Lord, when did we see you hungry and feed you, or thirsty and give you drink?",,,,,,,,,,,,,
,25,38,"And when did we see you a stranger and welcome you, or naked and clothe you?",,,,,,,,,,,,,
,25,39,And when did we see you sick or in prison and visit you?',,,,,,,,,,,,,
,25,40,"And the King will answer them, 'Truly, I say to you, as you did it to one of the least of these my brothers, you did it to me.'",,,,,,,,,,,,,
,25,41,"""Then he will say to those on his left, 'Depart from me, you cursed, into the eternal fire prepared for the devil and his angels.",,,,,,,,,,,,,
,25,42,"For I was hungry and you gave me no food, I was thirsty and you gave me no drink,",,,,,,,,,,,,,
,25,43,"I was a stranger and you did not welcome me, naked and you did not clothe me, sick and in prison and you did not visit me.'",,,,,,,,,,,,,
,25,44,"Then they also will answer, saying, 'Lord, when did we see you hungry or thirsty or a stranger or naked or sick or in prison, and did not minister to you?'",,,,,,,,,,,,,
,25,45,"Then he will answer them, saying, 'Truly, I say to you, as you did not do it to one of the least of these, you did not do it to me.'",,,,,,,,,,,,,
,25,46,"And these will go away into eternal punishment, but the righteous into eternal life.""",,,,,,,,,,,,,
*,26,1,"When Jesus had finished all these sayings, he said to his disciples,",,,,,,,,,,,,,
,26,2,"""You know that after two days the Passover is coming, and the Son of Man will be delivered up to be crucified.""",,,,,,,,,,,,,
,,,,,,,,,21,37,"And every day he was teaching in the temple, but at night he went out and lodged on the mount called Olivet.",,,,,
,,,,,,,,,21,38,And early in the morning all the people came to him in the temple to hear him.,,,,,
,,,,,,,,,,,,,12,20,Now among those who went up to worship at the feast were some Greeks.,
,,,,,,,,,,,,,12,21,"So these came to Philip, who was from Bethsaida in Galilee, and asked him, ""Sir, we wish to see Jesus.""",
,,,,,,,,,,,,,12,22,Philip went and told Andrew; Andrew and Philip went and told Jesus.,
,,,,,,,,,,,,,12,23,"And Jesus answered them, ""The hour has come for the Son of Man to be glorified.",
,,,,,,,,,,,,,12,24,"Truly, truly, I say to you, unless a grain of wheat falls into the earth and dies, it remains alone; but if it dies, it bears much fruit.",
,,,,,,,,,,,,,12,25,"Whoever loves his life loses it, and whoever hates his life in this world will keep it for eternal life.",
,,,,,,,,,,,,,12,26,"If anyone serves me, he must follow me; and where I am, there will my servant be also. If anyone serves me, the Father will honor him.",
,,,,,,,,,,,,,12,27,"""Now is my soul troubled. And what shall I say? 'Father, save me from this hour'? But for this purpose I have come to this hour.",
,,,,,,,,,,,,,12,28,"Father, glorify your name."" Then a voice came from heaven: ""I have glorified it, and I will glorify it again.""",
,,,,,,,,,,,,,12,29,"The crowd that stood there and heard it said that it had thundered. Others said, ""An angel has spoken to him.""",
,,,,,,,,,,,,,12,30,"Jesus answered, ""This voice has come for your sake, not mine.",
,,,,,,,,,,,,,12,31,Now is the judgment of this world; now will the ruler of this world be cast out.,
,,,,,,,,,,,,,12,32,"And I, when I am lifted up from the earth, will draw all people to myself.""",
,,,,,,,,,,,,,12,33,He said this to show by what kind of death he was going to die.,
,,,,,,,,,,,,,12,34,"So the crowd answered him, ""We have heard from the Law that the Christ remains forever. How can you say that the Son of Man must be lifted up? Who is this Son of Man?""",
,,,,,,,,,,,,,12,35,"So Jesus said to them, ""The light is among you for a little while longer. Walk while you have the light, lest darkness overtake you. The one who walks in the darkness does not know where he is going.",
,,,,,,,,,,,,,12,36,"While you have the light, believe in the light, that you may become sons of light.""When Jesus had said these things, he departed and hid himself from them.",
,,,,,,,,,,,,,12,37,"Though he had done so many signs before them, they still did not believe in him,",
,,,,,,,,,,,,,12,38,"so that the word spoken by the prophet Isaiah might be fulfilled: ""Lord, who has believed what he heard from us, and to whom has the arm of the Lord been revealed?""",
,,,,,,,,,,,,,12,39,"Therefore they could not believe. For again Isaiah said,",
,,,,,,,,,,,,,12,40,"""He has blinded their eyes and hardened their heart, lest they see with their eyes, and understand with their heart, and turn, and I would heal them.""",
,,,,,,,,,,,,,12,41,Isaiah said these things because he saw his glory and spoke of him.,
,,,,,,,,,,,,,12,42,"Nevertheless, many even of the authorities believed in him, but for fear of the Pharisees they did not confess it, so that they would not be put out of the synagogue;",
,,,,,,,,,,,,,12,43,for they loved the glory that comes from man more than the glory that comes from God.,
,,,,,,,,,,,,,12,44,"And Jesus cried out and said, ""Whoever believes in me, believes not in me but in him who sent me.",
,,,,,,,,,,,,,12,45,And whoever sees me sees him who sent me.,
,,,,,,,,,,,,,12,46,"I have come into the world as light, so that whoever believes in me may not remain in darkness.",
,,,,,,,,,,,,,12,47,"If anyone hears my words and does not keep them, I do not judge him; for I did not come to judge the world but to save the world.",
,,,,,,,,,,,,,12,48,The one who rejects me and does not receive my words has a judge; the word that I have spoken will judge him on the last day.,
,,,,,,,,,,,,,12,49,"For I have not spoken on my own authority, but the Father who sent me has himself given me a commandment--what to say and what to speak.",
,,,,,,,,,,,,,12,50,"And I know that his commandment is eternal life. What I say, therefore, I say as the Father has told me.""",
,26,3,"Then the chief priests and the elders of the people gathered in the palace of the high priest, whose name was Caiaphas,",,14,1,"It was now two days before the Passover and the Feast of Unleavened Bread. And the chief priests and the scribes were seeking how to arrest him by stealth and kill him,",,22,1,"Now the Feast of Unleavened Bread drew near, which is called the Passover.",,,,,
,26,4,and plotted together in order to arrest Jesus by stealth and kill him.,,14,2,"for they said, ""Not during the feast, lest there be an uproar from the people.""",,22,2,"And the chief priests and the scribes were seeking how to put him to death, for they feared the people.",,,,,
,26,5,"But they said, ""Not during the feast, lest there be an uproar among the people.""",,,,,,,,,,,,,
,,,,,,,,,,,,,,,,
*,26,14,"Then one of the twelve, whose name was Judas Iscariot, went to the chief priests",,14,10,"Then Judas Iscariot, who was one of the twelve, went to the chief priests in order to betray him to them.",,22,3,"Then Satan entered into Judas called Iscariot, who was of the number of the twelve.",,,,,
,26,15,"and said, ""What will you give me if I deliver him over to you?"" And they paid him thirty pieces of silver.",,14,11,"And when they heard it, they were glad and promised to give him money. And he sought an opportunity to betray him.",,22,4,He went away and conferred with the chief priests and officers how he might betray him to them.,,,,,
,26,16,And from that moment he sought an opportunity to betray him.,,,,,,22,5,"And they were glad, and agreed to give him money.",,,,,
,,,,,,,,,22,6,So he consented and sought an opportunity to betray him to them in the absence of a crowd.,,,,,
*,26,17,"Now on the first day of Unleavened Bread the disciples came to Jesus, saying, ""Where will you have us prepare for you to eat the Passover?""",,14,12,"And on the first day of Unleavened Bread, when they sacrificed the Passover lamb, his disciples said to him, ""Where will you have us go and prepare for you to eat the Passover?""",,22,7,"Then came the day of Unleavened Bread, on which the Passover lamb had to be sacrificed.",,,,,
,26,18,"He said, ""Go into the city to a certain man and say to him, 'The Teacher says, My time is at hand. I will keep the Passover at your house with my disciples.'""",,14,13,"And he sent two of his disciples and said to them, ""Go into the city, and a man carrying a jar of water will meet you. Follow him,",,22,8,"So Jesus sent Peter and John, saying, ""Go and prepare the Passover for us, that we may eat it.""",,,,,
,26,19,"And the disciples did as Jesus had directed them, and they prepared the Passover.",,14,14,"and wherever he enters, say to the master of the house, 'The Teacher says, Where is my guest room, where I may eat the Passover with my disciples?'",,22,9,"They said to him, ""Where will you have us prepare it?""",,,,,
,,,,,14,15,"And he will show you a large upper room furnished and ready; there prepare for us.""",,22,10,"He said to them, ""Behold, when you have entered the city, a man carrying a jar of water will meet you. Follow him into the house that he enters",,,,,
,,,,,14,16,"And the disciples set out and went to the city and found it just as he had told them, and they prepared the Passover.",,22,11,"and tell the master of the house, 'The Teacher says to you, Where is the guest room, where I may eat the Passover with my disciples?'",,,,,
,,,,,,,,,22,12,"And he will show you a large upper room furnished; prepare it there.""",,,,,
,,,,,,,,,22,13,"And they went and found it just as he had told them, and they prepared the Passover.",,,,,
*,26,20,"When it was evening, he reclined at table with the twelve.",,14,17,"And when it was evening, he came with the twelve.",,22,14,"And when the hour came, he reclined at table, and the apostles with him.",,,,,
*,,,,,,,,,,,,,13,1,"Now before the Feast of the Passover, when Jesus knew that his hour had come to depart out of this world to the Father, having loved his own who were in the world, he loved them to the end.",
,,,,,,,,,,,,,13,2,"During supper, when the devil had already put it into the heart of Judas Iscariot, Simon's son, to betray him,",
,,,,,,,,,,,,,13,3,"Jesus, knowing that the Father had given all things into his hands, and that he had come from God and was going back to God,",
,,,,,,,,,,,,,13,4,"rose from supper. He laid aside his outer garments, and taking a towel, tied it around his waist.",
,,,,,,,,,,,,,13,5,Then he poured water into a basin and began to wash the disciples' feet and to wipe them with the towel that was wrapped around him.,
,,,,,,,,,,,,,13,6,"He came to Simon Peter, who said to him, ""Lord, do you wash my feet?""",
,,,,,,,,,,,,,13,7,"Jesus answered him, ""What I am doing you do not understand now, but afterward you will understand.""",
,,,,,,,,,,,,,13,8,"Peter said to him, ""You shall never wash my feet."" Jesus answered him, ""If I do not wash you, you have no share with me.""",
