Section,Matthew,,,,Mark,,,,Luke,,,,John,,,
,,,,,,,,,,,,,8,49,"Jesus answered, ""I do not have a demon, but I honor my Father, and you dishonor me.",
,,,,,,,,,,,,,8,50,"Yet I do not seek my own glory; there is One who seeks it, and he is the judge.",
,,,,,,,,,,,,,8,51,"Truly, truly, I say to you, if anyone keeps my word, he will never see death.""",
,,,,,,,,,,,,,8,52,"The Jews said to him, ""Now we know that you have a demon! Abraham died, as did the prophets, yet you say, 'If anyone keeps my word, he will never taste death.'",
,,,,,,,,,,,,,8,53,"Are you greater than our father Abraham, who died? And the prophets died! Who do you make yourself out to be?""",
,,,,,,,,,,,,,8,54,"Jesus answered, ""If I glorify myself, my glory is nothing. It is my Father who glorifies me, of whom you say, 'He is our God.'",
,,,,,,,,,,,,,8,55,"But you have not known him. I know him. If I were to say that I do not know him, I would be a liar like you, but I do know him and I keep his word.",
,,,,,,,,,,,,,8,56,"Your father Abraham rejoiced that he would see my day. He saw it and was glad.""",
,,,,,,,,,,,,,8,57,"So the Jews said to him, ""You are not yet fifty years old, and have you seen Abraham?""",
,,,,,,,,,,,,,8,58,"Jesus said to them, ""Truly, truly, I say to you, before Abraham was, I am.""",
,,,,,,,,,,,,,8,59,"So they picked up stones to throw at him, but Jesus hid himself and went out of the temple.",
,,,,,,,,,,,,,9,1,"As he passed by, he saw a man blind from birth.",
,,,,,,,,,,,,,9,2,"And his disciples asked him, ""Rabbi, who sinned, this man or his parents, that he was born blind?""",
,,,,,,,,,,,,,9,3,"Jesus answered, ""It was not that this man sinned, or his parents, but that the works of God might be displayed in him.",
,,,,,,,,,,,,,9,4,"We must work the works of him who sent me while it is day; night is coming, when no one can work.",
,,,,,,,,,,,,,9,5,"As long as I am in the world, I am the light of the world.""",
,,,,,,,,,,,,,9,6,"Having said these things, he spat on the ground and made mud with the saliva. Then he anointed the man's eyes with the mud",
,,,,,,,,,,,,,9,7,"and said to him, ""Go, wash in the pool of Siloam"" (which means Sent). So he went and washed and came back seeing.",
,,,,,,,,,,,,,9,8,"The neighbors and those who had seen him before as a beggar were saying, ""Is this not the man who used to sit and beg?""",
,,,,,,,,,,,,,9,9,"Some said, ""It is he."" Others said, ""No, but he is like him."" He kept saying, ""I am the man.""",
,,,,,,,,,,,,,9,10,"So they said to him, ""Then how were your eyes opened?""",
,,,,,,,,,,,,,9,11,"He answered, ""The man called Jesus made mud and anointed my eyes and said to me, 'Go to Siloam and wash.' So I went and washed and received my sight.""",
,,,,,,,,,,,,,9,12,"They said to him, ""Where is he?"" He said, ""I do not know.""",
,,,,,,,,,,,,,9,13,They brought to the Pharisees the man who had formerly been blind.,
,,,,,,,,,,,,,9,14,Now it was a Sabbath day when Jesus made the mud and opened his eyes.,
,,,,,,,,,,,,,9,15,"So the Pharisees again asked him how he had received his sight. And he said to them, ""He put mud on my eyes, and I washed, and I see.""",
,,,,,,,,,,,,,9,16,"Some of the Pharisees said, ""This man is not from God, for he does not keep the Sabbath."" But others said, ""How can a man who is a sinner do such signs?"" And there was a division among them.",
,,,,,,,,,,,,,9,17,"So they said again to the blind man, ""What do you say about him, since he has opened your eyes?"" He said, ""He is a prophet.""",
,,,,,,,,,,,,,9,18,"The Jews did not believe that he had been blind and had received his sight, until they called the parents of the man who had received his sight",
,,,,,,,,,,,,,9,19,"and asked them, ""Is this your son, who you say was born blind? How then does he now see?""",
,,,,,,,,,,,,,9,20,"His parents answered, ""We know that this is our son and that he was born blind.",
,,,,,,,,,,,,,9,21,"But how he now sees we do not know, nor do we know who opened his eyes. Ask him; he is of age. He will speak for himself.""",
,,,,,,,,,,,,,9,22,"(His parents said these things because they feared the Jews, for the Jews had already agreed that if anyone should confess Jesus to be Christ, he was to be put out of the synagogue.)",
,,,,,,,,,,,,,9,23,"Therefore his parents said, ""He is of age; ask him.""",
,,,,,,,,,,,,,9,24,"So for the second time they called the man who had been blind and said to him, ""Give glory to God. We know that this man is a sinner.""",
,,,,,,,,,,,,,9,25,"He answered, ""Whether he is a sinner I do not know. One thing I do know, that though I was blind, now I see.""",
,,,,,,,,,,,,,9,26,"They said to him, ""What did he do to you? How did he open your eyes?""",
,,,,,,,,,,,,,9,27,"He answered them, ""I have told you already, and you would not listen. Why do you want to hear it again? Do you also want to become his disciples?""",
,,,,,,,,,,,,,9,28,"And they reviled him, saying, ""You are his disciple, but we are disciples of Moses.",
,,,,,,,,,,,,,9,29,"We know that God has spoken to Moses, but as for this man, we do not know where he comes from.""",
,,,,,,,,,,,,,9,30,"The man answered, ""Why, this is an amazing thing! You do not know where he comes from, and yet he opened my eyes.",
,,,,,,,,,,,,,9,31,"We know that God does not listen to sinners, but if anyone is a worshiper of God and does his will, God listens to him.",
,,,,,,,,,,,,,9,32,Never since the world began has it been heard that anyone opened the eyes of a man born blind.,
,,,,,,,,,,,,,9,33,"If this man were not from God, he could do nothing.""",
,,,,,,,,,,,,,9,34,"They answered him, ""You were born in utter sin, and would you teach us?"" And they cast him out.",
,,,,,,,,,,,,,9,35,"Jesus heard that they had cast him out, and having found him he said, ""Do you believe in the Son of Man?""",
,,,,,,,,,,,,,9,36,"He answered, ""And who is he, sir, that I may believe in him?""",
,,,,,,,,,,,,,9,37,"Jesus said to him, ""You have seen him, and it is he who is speaking to you.""",
,,,,,,,,,,,,,9,38,"He said, ""Lord, I believe,"" and he worshiped him.",
,,,,,,,,,,,,,9,39,"Jesus said, ""For judgment I came into this world, that those who do not see may see, and those who see may become blind.""",
,,,,,,,,,,,,,9,40,"Some of the Pharisees near him heard these things, and said to him, ""Are we also blind?""",
,,,,,,,,,,,,,9,41,"Jesus said to them, ""If you were blind, you would have no guilt; but now that you say, 'We see,' your guilt remains.",
,,,,,,,,,,,,,10,1,"""Truly, truly, I say to you, he who does not enter the sheepfold by the door but climbs in by another way, that man is a thief and a robber.",
,,,,,,,,,,,,,10,2,But he who enters by the door is the shepherd of the sheep.,
,,,,,,,,,,,,,10,3,"To him the gatekeeper opens. The sheep hear his voice, and he calls his own sheep by name and leads them out.",
,,,,,,,,,,,,,10,4,"When he has brought out all his own, he goes before them, and the sheep follow him, for they know his voice.",
,,,,,,,,,,,,,10,5,"A stranger they will not follow, but they will flee from him, for they do not know the voice of strangers.""",
,,,,,,,,,,,,,10,6,"This figure of speech Jesus used with them, but they did not understand what he was saying to them.",
,,,,,,,,,,,,,10,7,"So Jesus again said to them, ""Truly, truly, I say to you, I am the door of the sheep.",
,,,,,,,,,,,,,10,8,"All who came before me are thieves and robbers, but the sheep did not listen to them.",
,,,,,,,,,,,,,10,9,"I am the door. If anyone enters by me, he will be saved and will go in and out and find pasture.",
,,,,,,,,,,,,,10,10,The thief comes only to steal and kill and destroy. I came that they may have life and have it abundantly.,
,,,,,,,,,,,,,10,11,I am the good shepherd. The good shepherd lays down his life for the sheep.,
,,,,,,,,,,,,,10,12,"He who is a hired hand and not a shepherd, who does not own the sheep, sees the wolf coming and leaves the sheep and flees, and the wolf snatches them and scatters them.",
,,,,,,,,,,,,,10,13,He flees because he is a hired hand and cares nothing for the sheep.,
,,,,,,,,,,,,,10,14,"I am the good shepherd. I know my own and my own know me,",
,,,,,,,,,,,,,10,15,just as the Father knows me and I know the Father; and I lay down my life for the sheep.,
,,,,,,,,,,,,,10,16,"And I have other sheep that are not of this fold. I must bring them also, and they will listen to my voice. So there will be one flock, one shepherd.",
,,,,,,,,,,,,,10,17,"For this reason the Father loves me, because I lay down my life that I may take it up again.",
,,,,,,,,,,,,,10,18,"No one takes it from me, but I lay it down of my own accord. I have authority to lay it down, and I have authority to take it up again. This charge I have received from my Father.""",
,,,,,,,,,,,,,10,19,There was again a division among the Jews because of these words.,
,,,,,,,,,,,,,10,20,"Many of them said, ""He has a demon, and is insane; why listen to him?""",
,,,,,,,,,,,,,10,21,"Others said, ""These are not the words of one who is oppressed by a demon. Can a demon open the eyes of the blind?""",
,,,,,,,,,,,,,,,,
,,,,,,,,,10,1,"After this the Lord appointed seventy-two others and sent them on ahead of him, two by two, into every town and place where he himself was about to go.",,,,,
,,,,,,,,,10,2,"And he said to them, ""The harvest is plentiful, but the laborers are few. Therefore pray earnestly to the Lord of the harvest to send out laborers into his harvest.",,,,,
,,,,,,,,,10,3,"Go your way; behold, I am sending you out as lambs in the midst of wolves.",,,,,
,,,,,,,,,10,4,"Carry no moneybag, no knapsack, no sandals, and greet no one on the road.",,,,,
,,,,,,,,,10,5,"Whatever house you enter, first say, 'Peace be to this house!'",,,,,
,,,,,,,,,10,6,"And if a son of peace is there, your peace will rest upon him. But if not, it will return to you.",,,,,
,,,,,,,,,10,7,"And remain in the same house, eating and drinking what they provide, for the laborer deserves his wages. Do not go from house to house.",,,,,
,,,,,,,,,10,8,"Whenever you enter a town and they receive you, eat what is set before you.",,,,,
,,,,,,,,,10,9,"Heal the sick in it and say to them, 'The kingdom of God has come near to you.'",,,,,
,,,,,,,,,10,10,"But whenever you enter a town and they do not receive you, go into its streets and say,",,,,,
,,,,,,,,,10,11,"'Even the dust of your town that clings to our feet we wipe off against you. Nevertheless know this, that the kingdom of God has come near.'",,,,,
,,,,,,,,,10,12,"I tell you, it will be more bearable on that day for Sodom than for that town.",,,,,
,,,,,,,,,10,13,"""Woe to you, Chorazin! Woe to you, Bethsaida! For if the mighty works done in you had been done in Tyre and Sidon, they would have repented long ago, sitting in sackcloth and ashes.",,,,,
,,,,,,,,,10,14,But it will be more bearable in the judgment for Tyre and Sidon than for you.,,,,,
,,,,,,,,,10,15,"And you, Capernaum, will you be exalted to heaven? You shall be brought down to Hades.",,,,,
,,,,,,,,,10,16,"""The one who hears you hears me, and the one who rejects you rejects me, and the one who rejects me rejects him who sent me.""",,,,,
,,,,,,,,,10,17,"The seventy-two returned with joy, saying, ""Lord, even the demons are subject to us in your name!""",,,,,
,,,,,,,,,10,18,"And he said to them, ""I saw Satan fall like lightning from heaven.",,,,,
,,,,,,,,,10,19,"Behold, I have given you authority to tread on serpents and scorpions, and over all the power of the enemy, and nothing shall hurt you.",,,,,
,,,,,,,,,10,20,"Nevertheless, do not rejoice in this, that the spirits are subject to you, but rejoice that your names are written in heaven.""",,,,,
,,,,,,,,,10,21,"In that same hour he rejoiced in the Holy Spirit and said, ""I thank you, Father, Lord of heaven and earth, that you have hidden these things from the wise and understanding and revealed them to little children; yes, Father, for such was your gracious will.",,,,,
,,,,,,,,,10,22,"All things have been handed over to me by my Father, and no one knows who the Son is except the Father, or who the Father is except the Son and anyone to whom the Son chooses to reveal him.""",,,,,
,,,,,,,,,10,23,"Then turning to the disciples he said privately, ""Blessed are the eyes that see what you see!",,,,,
,,,,,,,,,10,24,"For I tell you that many prophets and kings desired to see what you see, and did not see it, and to hear what you hear, and did not hear it.""",,,,,
,,,,,,,,,10,25,"And behold, a lawyer stood up to put him to the test, saying, ""Teacher, what shall I do to inherit eternal life?""",,,,,
,,,,,,,,,10,26,"He said to him, ""What is written in the Law? How do you read it?""",,,,,
,,,,,,,,,10,27,"And he answered, ""You shall love the Lord your God with all your heart and with all your soul and with all your strength and with all your mind, and your neighbor as yourself.""",,,,,
,,,,,,,,,10,28,"And he said to him, ""You have answered correctly; do this, and you will live.""",,,,,
,,,,,,,,,10,29,"But he, desiring to justify himself, said to Jesus, ""And who is my neighbor?""",,,,,
,,,,,,,,,10,30,"Jesus replied, ""A man was going down from Jerusalem to Jericho, and he fell among robbers, who stripped him and beat him and departed, leaving him half dead.",,,,,
,,,,,,,,,10,31,"Now by chance a priest was going down that road, and when he saw him he passed by on the other side.",,,,,
,,,,,,,,,10,32,"So likewise a Levite, when he came to the place and saw him, passed by on the other side.",,,,,
,,,,,,,,,10,33,"But a Samaritan, as he journeyed, came to where he was, and when he saw him, he had compassion.",,,,,
,,,,,,,,,10,34,"He went to him and bound up his wounds, pouring on oil and wine. Then he set him on his own animal and brought him to an inn and took care of him.",,,,,
,,,,,,,,,10,35,"And the next day he took out two denarii and gave them to the innkeeper, saying, 'Take care of him, and whatever more you spend, I will repay you when I come back.'",,,,,
,,,,,,,,,10,36,"Which of these three, do you think, proved to be a neighbor to the man who fell among the robbers?""",,,,,
,,,,,,,,,10,37,"He said, ""The one who showed him mercy."" And Jesus said to him, ""You go, and do likewise.""",,,,,
,,,,,,,,,10,38,"Now as they went on their way, Jesus entered a village. And a woman named Martha welcomed him into her house.",,,,,
,,,,,,,,,10,39,"And she had a sister called Mary, who sat at the Lord's feet and listened to his teaching.",,,,,
,,,,,,,,,10,40,"But Martha was distracted with much serving. And she went up to him and said, ""Lord, do you not care that my sister has left me to serve alone? Tell her then to help me.""",,,,,
,,,,,,,,,10,41,"But the Lord answered her, ""Martha, Martha, you are anxious and troubled about many things,",,,,,
,,,,,,,,,10,42,"but one thing is necessary. Mary has chosen the good portion, which will not be taken away from her.""",,,,,
,,,,,,,,,11,1,"Now Jesus was praying in a certain place, and when he finished, one of his disciples said to him, ""Lord, teach us to pray, as John taught his disciples.""",,,,,
,,,,,,,,,11,2,"And he said to them, ""When you pray, say: ""Father, hallowed be your name. Your kingdom come.",,,,,
,,,,,,,,,11,3,"Give us each day our daily bread,",,,,,
,,,,,,,,,11,4,"and forgive us our sins, for we ourselves forgive everyone who is indebted to us. And lead us not into temptation.""",,,,,
,,,,,,,,,11,5,"And he said to them, ""Which of you who has a friend will go to him at midnight and say to him, 'Friend, lend me three loaves,",,,,,
,,,,,,,,,11,6,"for a friend of mine has arrived on a journey, and I have nothing to set before him';",,,,,
,,,,,,,,,11,7,"and he will answer from within, 'Do not bother me; the door is now shut, and my children are with me in bed. I cannot get up and give you anything'?",,,,,
,,,,,,,,,11,8,"I tell you, though he will not get up and give him anything because he is his friend, yet because of his impudence he will rise and give him whatever he needs.",,,,,
,,,,,,,,,11,9,"And I tell you, ask, and it will be given to you; seek, and you will find; knock, and it will be opened to you.",,,,,
,,,,,,,,,11,10,"For everyone who asks receives, and the one who seeks finds, and to the one who knocks it will be opened.",,,,,
,,,,,,,,,11,11,"What father among you, if his son asks for a fish, will instead of a fish give him a serpent;",,,,,
,,,,,,,,,11,12,"or if he asks for an egg, will give him a scorpion?",,,,,
,,,,,,,,,11,13,"If you then, who are evil, know how to give good gifts to your children, how much more will the heavenly Father give the Holy Spirit to those who ask him!""",,,,,
,,,,,,,,,11,14,"Now he was casting out a demon that was mute. When the demon had gone out, the mute man spoke, and the people marveled.",,,,,
,,,,,,,,,11,15,"But some of them said, ""He casts out demons by Beelzebul, the prince of demons,""",,,,,
,,,,,,,,,11,16,"while others, to test him, kept seeking from him a sign from heaven.",,,,,
,,,,,,,,,11,17,"But he, knowing their thoughts, said to them, ""Every kingdom divided against itself is laid waste, and a divided household falls.",,,,,
,,,,,,,,,11,18,"And if Satan also is divided against himself, how will his kingdom stand? For you say that I cast out demons by Beelzebul.",,,,,
,,,,,,,,,11,19,"And if I cast out demons by Beelzebul, by whom do your sons cast them out? Therefore they will be your judges.",,,,,
,,,,,,,,,11,20,"But if it is by the finger of God that I cast out demons, then the kingdom of God has come upon you.",,,,,
,,,,,,,,,11,21,"When a strong man, fully armed, guards his own palace, his goods are safe;",,,,,
,,,,,,,,,11,22,"but when one stronger than he attacks him and overcomes him, he takes away his armor in which he trusted and divides his spoil.",,,,,
,,,,,,,,,11,23,"Whoever is not with me is against me, and whoever does not gather with me scatters.",,,,,
,,,,,,,,,11,24,"""When the unclean spirit has gone out of a person, it passes through waterless places seeking rest, and finding none it says, 'I will return to my house from which I came.'",,,,,
,,,,,,,,,11,25,"And when it comes, it finds the house swept and put in order.",,,,,
,,,,,,,,,11,26,"Then it goes and brings seven other spirits more evil than itself, and they enter and dwell there. And the last state of that person is worse than the first.""",,,,,
,,,,,,,,,11,27,"As he said these things, a woman in the crowd raised her voice and said to him, ""Blessed is the womb that bore you, and the breasts at which you nursed!""",,,,,
,,,,,,,,,11,28,"But he said, ""Blessed rather are those who hear the word of God and keep it!""",,,,,
,,,,,,,,,11,29,"When the crowds were increasing, he began to say, ""This generation is an evil generation. It seeks for a sign, but no sign will be given to it except the sign of Jonah.",,,,,
,,,,,,,,,11,30,"For as Jonah became a sign to the people of Nineveh, so will the Son of Man be to this generation.",,,,,
,,,,,,,,,11,31,"The queen of the South will rise up at the judgment with the men of this generation and condemn them, for she came from the ends of the earth to hear the wisdom of Solomon, and behold, something greater than Solomon is here.",,,,,
,,,,,,,,,11,32,"The men of Nineveh will rise up at the judgment with this generation and condemn it, for they repented at the preaching of Jonah, and behold, something greater than Jonah is here.",,,,,
,,,,,,,,,11,33,"""No one after lighting a lamp puts it in a cellar or under a basket, but on a stand, so that those who enter may see the light.",,,,,
,,,,,,,,,11,34,"Your eye is the lamp of your body. When your eye is healthy, your whole body is full of light, but when it is bad, your body is full of darkness.",,,,,
,,,,,,,,,11,35,Therefore be careful lest the light in you be darkness.,,,,,
,,,,,,,,,11,36,"If then your whole body is full of light, having no part dark, it will be wholly bright, as when a lamp with its rays gives you light.""",,,,,
,,,,,,,,,11,37,"While Jesus was speaking, a Pharisee asked him to dine with him, so he went in and reclined at table.",,,,,
,,,,,,,,,11,38,The Pharisee was astonished to see that he did not first wash before dinner.,,,,,
,,,,,,,,,11,39,"And the Lord said to him, ""Now you Pharisees cleanse the outside of the cup and of the dish, but inside you are full of greed and wickedness.",,,,,
,,,,,,,,,11,40,You fools! Did not he who made the outside make the inside also?,,,,,
,,,,,,,,,11,41,"But give as alms those things that are within, and behold, everything is clean for you.",,,,,
,,,,,,,,,11,42,"""But woe to you Pharisees! For you tithe mint and rue and every herb, and neglect justice and the love of God. These you ought to have done, without neglecting the others.",,,,,
,,,,,,,,,11,43,Woe to you Pharisees! For you love the best seat in the synagogues and greetings in the marketplaces.,,,,,
,,,,,,,,,11,44,"Woe to you! For you are like unmarked graves, and people walk over them without knowing it.""",,,,,
,,,,,,,,,11,45,"One of the lawyers answered him, ""Teacher, in saying these things you insult us also.""",,,,,
,,,,,,,,,11,46,"And he said, ""Woe to you lawyers also! For you load people with burdens hard to bear, and you yourselves do not touch the burdens with one of your fingers.",,,,,
,,,,,,,,,11,47,Woe to you! For you build the tombs of the prophets whom your fathers killed.,,,,,
,,,,,,,,,11,48,"So you are witnesses and you consent to the deeds of your fathers, for they killed them, and you build their tombs.",,,,,
,,,,,,,,,11,49,"Therefore also the Wisdom of God said, 'I will send them prophets and apostles, some of whom they will kill and persecute,'",,,,,
,,,,,,,,,11,50,"so that the blood of all the prophets, shed from the foundation of the world, may be charged against this generation,",,,,,
,,,,,,,,,11,51,"from the blood of Abel to the blood of Zechariah, who perished between the altar and the sanctuary. Yes, I tell you, it will be required of this generation.",,,,,
,,,,,,,,,11,52,"Woe to you lawyers! For you have taken away the key of knowledge. You did not enter yourselves, and you hindered those who were entering.""",,,,,
,,,,,,,,,11,53,"As he went away from there, the scribes and the Pharisees began to press him hard and to provoke him to speak about many things,",,,,,
,,,,,,,,,11,54,"lying in wait for him, to catch him in something he might say.",,,,,
,,,,,,,,,12,1,"In the meantime, when so many thousands of the people had gathered together that they were trampling one another, he began to say to his disciples first, ""Beware of the leaven of the Pharisees, which is hypocrisy.",,,,,
,,,,,,,,,12,2,"Nothing is covered up that will not be revealed, or hidden that will not be known.",,,,,
,,,,,,,,,12,3,"Therefore whatever you have said in the dark shall be heard in the light, and what you have whispered in private rooms shall be proclaimed on the housetops.",,,,,
,,,,,,,,,12,4,"""I tell you, my friends, do not fear those who kill the body, and after that have nothing more that they can do.",,,,,
,,,,,,,,,12,5,"But I will warn you whom to fear: fear him who, after he has killed, has authority to cast into hell. Yes, I tell you, fear him!",,,,,
,,,,,,,,,12,6,Are not five sparrows sold for two pennies? And not one of them is forgotten before God.,,,,,
,,,,,,,,,12,7,"Why, even the hairs of your head are all numbered. Fear not; you are of more value than many sparrows.",,,,,
,,,,,,,,,12,8,"""And I tell you, everyone who acknowledges me before men, the Son of Man also will acknowledge before the angels of God,",,,,,
,,,,,,,,,12,9,but the one who denies me before men will be denied before the angels of God.,,,,,
,,,,,,,,,12,10,"And everyone who speaks a word against the Son of Man will be forgiven, but the one who blasphemes against the Holy Spirit will not be forgiven.",,,,,
,,,,,,,,,12,11,"And when they bring you before the synagogues and the rulers and the authorities, do not be anxious about how you should defend yourself or what you should say,",,,,,
,,,,,,,,,12,12,"for the Holy Spirit will teach you in that very hour what you ought to say.""",,,,,
,,,,,,,,,12,13,"Someone in the crowd said to him, ""Teacher, tell my brother to divide the inheritance with me.""",,,,,
,,,,,,,,,12,14,"But he said to him, ""Man, who made me a judge or arbitrator over you?""",,,,,
,,,,,,,,,12,15,"And he said to them, ""Take care, and be on your guard against all covetousness, for one's life does not consist in the abundance of his possessions.""",,,,,
,,,,,,,,,12,16,"And he told them a parable, saying, ""The land of a rich man produced plentifully,",,,,,
,,,,,,,,,12,17,"and he thought to himself, 'What shall I do, for I have nowhere to store my crops?'",,,,,
,,,,,,,,,12,18,"And he said, 'I will do this: I will tear down my barns and build larger ones, and there I will store all my grain and my goods.",,,,,
,,,,,,,,,12,19,"And I will say to my soul, Soul, you have ample goods laid up for many years; relax, eat, drink, be merry.'",,,,,
,,,,,,,,,12,20,"But God said to him, 'Fool! This night your soul is required of you, and the things you have prepared, whose will they be?'",,,,,
,,,,,,,,,12,21,"So is the one who lays up treasure for himself and is not rich toward God.""",,,,,
,,,,,,,,,12,22,"And he said to his disciples, ""Therefore I tell you, do not be anxious about your life, what you will eat, nor about your body, what you will put on.",,,,,
,,,,,,,,,12,23,"For life is more than food, and the body more than clothing.",,,,,
,,,,,,,,,12,24,"Consider the ravens: they neither sow nor reap, they have neither storehouse nor barn, and yet God feeds them. Of how much more value are you than the birds!",,,,,
,,,,,,,,,12,25,And which of you by being anxious can add a single hour to his span of life?,,,,,
,,,,,,,,,12,26,"If then you are not able to do as small a thing as that, why are you anxious about the rest?",,,,,
,,,,,,,,,12,27,"Consider the lilies, how they grow: they neither toil nor spin, yet I tell you, even Solomon in all his glory was not arrayed like one of these.",,,,,
